{
  "$schema": "https://json-schema.org/draft/2020-12/schema",
  "$id": "https://commandlayer.org/agent-cards/schemas/v1.0.0/_shared/agent.card.base.schema.json",
  "title": "CommandLayer Agent Card (v1.0.0)",
  "type": "object",
  "additionalProperties": false,
  "required": [
    "id",
    "slug",
    "display_name",
    "description",
    "owner",
    "ens",
    "version",
    "status",
    "class",
    "implements",
    "entry",
    "schemas",
    "networks",
    "license",
    "created_at",
    "updated_at"
  ],
  "properties": {
    "$schema": {
      "type": "string",
      "format": "uri"
    },
    "$id": {
      "type": "string",
      "format": "uri"
    },
    "id": {
      "type": "string"
    },
    "slug": {
      "type": "string"
    },
    "display_name": {
      "type": "string"
    },
    "description": {
      "type": "string"
    },
    "owner": {
      "type": "string"
    },
    "ens": {
      "type": "string"
    },
    "version": {
      "type": "string"
    },
    "status": {
      "type": "string"
    },
    "class": {
      "type": "string",
      "enum": [
        "commons",
        "commercial"
      ]
    },
    "implements": {
      "type": "array",
      "items": {
        "type": "string"
      },
      "minItems": 1
    },
    "entry": {
      "type": "string",
      "description": "Class-specific execution entry. Commons cards use the canonical runtime execute URL; commercial cards use x402 routing."
    },
    "schemas": {
      "type": "object",
      "additionalProperties": false,
      "required": [
        "request",
        "receipt"
      ],
      "properties": {
        "request": {
          "type": "string",
          "format": "uri"
        },
        "receipt": {
          "type": "string",
          "format": "uri"
        }
      }
    },
    "schemas_mirror": {
      "type": "object",
      "additionalProperties": false,
      "properties": {
        "request": {
          "type": "string",
          "format": "uri"
        },
        "receipt": {
          "type": "string",
          "format": "uri"
        }
      }
    },
    "capabilities": {
      "type": "object",
      "additionalProperties": true
    },
    "meta": {
      "type": "object",
      "additionalProperties": true
    },
    "networks": {
      "type": "array",
      "items": {
        "type": "string"
      },
      "minItems": 1
    },
    "license": {
      "type": "string"
    },
    "created_at": {
      "type": "string",
      "format": "date-time"
    },
    "updated_at": {
      "type": "string",
      "format": "date-time"
    }
  },
  "allOf": [
    {
      "if": {
        "properties": {
          "class": {
            "const": "commons"
          }
        },
        "required": [
          "class"
        ]
      },
      "then": {
        "properties": {
          "entry": {
            "const": "https://runtime.commandlayer.org/execute"
          }
        }
      }
    },
    {
      "if": {
        "properties": {
          "class": {
            "const": "commercial"
          }
        },
        "required": [
          "class"
        ]
      },
      "then": {
        "properties": {
          "entry": {
            "type": "string",
            "pattern": "^x402://[^/]+/[^/]+/v[0-9]+(?:\\.[0-9]+){0,2}$"
          }
        }
      }
    }
  ]
}
