{
  "$schema": "https://commandlayer.org/agent-cards/schemas/v1.0.0/commons/agent.card.base.schema.json",
  "$id": "https://commandlayer.org/agent-cards/agents/v1.0.0/commons/classifyagent.eth.json",

  "id": "classifyagent.eth",
  "slug": "classifyagent",
  "display_name": "Classify Agent (Protocol Reference)",
  "description": "Reference agent for the classify verb. Applies labels, categories, and tags according to the classify.request and classify.receipt schemas.",

  "owner": "commandlayer.eth",
  "ens": "classifyagent.eth",
  "version": "1.0.0",
  "status": "protocol_reference",
  "class": "commons",

  "implements": ["classify"],

  "schemas": {
    "request": "ipfs://bafybeigvf6nkzws7dblos74dqqjkguwkrwn4a2c27ieygoxmgofyzdkz6m/commons/classify/requests/classify.request.schema.json",
    "receipt": "ipfs://bafybeigvf6nkzws7dblos74dqqjkguwkrwn4a2c27ieygoxmgofyzdkz6m/commons/classify/receipts/classify.receipt.schema.json"
  },

  "entry": "x402://classifyagent.eth/classify/v1",

  "capabilities": {
    "operations": [
      "assign_labels",
      "multi_class_classification",
      "multi_label_classification"
    ],
    "input_types": [
      "text/plain",
      "text/markdown",
      "application/json"
    ],
    "output_types": [
      "application/json"
    ]
  },

  "meta": {
    "publisher": "CommandLayer",
    "contact": "dev@commandlayer.org",
    "pgp_fingerprint": "5016 D496 9F38 22B2 C5A2 FA40 99A2 6950 197D AB0A",
    "tags": [
      "classify",
      "labels",
      "protocol-reference"
    ]
  },

  "networks": ["eip155:1"],
  "license": "Apache-2.0",

  "created_at": "2025-11-22T00:00:00Z",
  "updated_at": "2025-11-22T00:00:00Z"
}
