{
  "$schema": "https://commandlayer.org/agent-cards/schemas/v1.0.0/_shared/agent.card.base.schema.json",
  "$id": "https://commandlayer.org/agent-cards/agents/v1.0.0/commons/convertagent.eth.json",
  "id": "convertagent.eth",
  "slug": "convertagent",
  "display_name": "Convert Agent",
  "description": "Reference agent for the convert verb. Transforms content or data between formats according to the convert.request and convert.receipt schemas.",
  "owner": "commandlayer.eth",
  "ens": "convertagent.eth",
  "version": "1.0.0",
  "status": "protocol_reference",
  "class": "commons",
  "implements": [
    "convert"
  ],
  "schemas": {
    "request": "ipfs://bafybeigvf6nkzws7dblos74dqqjkguwkrwn4a2c27ieygoxmgofyzdkz6m/commons/convert/requests/convert.request.schema.json",
    "receipt": "ipfs://bafybeigvf6nkzws7dblos74dqqjkguwkrwn4a2c27ieygoxmgofyzdkz6m/commons/convert/receipts/convert.receipt.schema.json"
  },
  "schemas_mirror": {
    "request": "https://commandlayer.org/schemas/v1.0.0/commons/convert/requests/convert.request.schema.json",
    "receipt": "https://commandlayer.org/schemas/v1.0.0/commons/convert/receipts/convert.receipt.schema.json"
  },
  "entry": "x402://convertagent.eth/convert/v1.0.0",
  "capabilities": {
    "operations": [
      "format_to_format",
      "unit_conversion",
      "structured_data_conversion"
    ],
    "input_types": [
      "text/plain",
      "text/markdown",
      "application/json"
    ],
    "output_types": [
      "text/plain",
      "application/json"
    ]
  },
  "meta": {
    "publisher": "CommandLayer",
    "contact": "dev@commandlayer.org",
    "tags": [
      "convert",
      "transform",
      "protocol-reference"
    ],
    "archival_note": "v1.0.0 is retained for compatibility only. Legacy PGP claims were removed because this repository no longer maintains a verifiable key-distribution path for them."
  },
  "networks": [
    "eip155:1"
  ],
  "license": "Apache-2.0",
  "created_at": "2025-11-22T00:00:00Z",
  "updated_at": "2025-11-22T00:00:00Z"
}
