{
  "$schema": "https://commandlayer.org/agent-cards/schemas/v1.0.0/_shared/agent.card.base.schema.json",
  "$id": "https://commandlayer.org/agent-cards/agents/v1.0.0/commercial/checkoutagent.eth.json",
  "id": "checkoutagent.eth",
  "slug": "checkoutagent",
  "display_name": "Checkout Agent",
  "description": "Commercial reference agent for the checkout verb. Turns carts into canonical orders and payment intents using checkout.request and checkout.receipt schemas.",
  "owner": "commandlayer.eth",
  "ens": "checkoutagent.eth",
  "version": "1.0.0",
  "status": "protocol_reference",
  "class": "commercial",
  "implements": [
    "checkout"
  ],
  "schemas": {
    "request": "https://commandlayer.org/schemas/v1.0.0/commercial/checkout/requests/checkout.request.schema.json",
    "receipt": "https://commandlayer.org/schemas/v1.0.0/commercial/checkout/receipts/checkout.receipt.schema.json"
  },
  "entry": "x402://checkoutagent.eth/checkout/v1.0.0",
  "capabilities": {
    "operations": [
      "create_order",
      "compute_total",
      "resolve_shipping",
      "initiate_payment_intent"
    ],
    "input_types": [
      "application/json"
    ],
    "output_types": [
      "application/json"
    ]
  },
  "meta": {
    "publisher": "CommandLayer",
    "contact": "dev@commandlayer.org",
    "pgp_fingerprint": "5016 D496 9F38 22B2 C5A2 FA40 99A2 6950 197D AB0A",
    "tags": [
      "checkout",
      "commercial",
      "orders",
      "payments"
    ],
    "notes": [
      "Legacy commercial v1.0.0 cards are preserved without mirror URLs because no canonical IPFS mirror binding was recorded for this line."
    ]
  },
  "networks": [
    "eip155:1"
  ],
  "license": "Apache-2.0",
  "created_at": "2025-11-22T00:00:00Z",
  "updated_at": "2025-11-22T00:00:00Z"
}
