{
  "$schema": "https://commandlayer.org/agent-cards/schemas/v1.0.0/_shared/agent.card.base.schema.json",
  "$id": "https://commandlayer.org/agent-cards/agents/v1.0.0/commercial/authorizeagent.eth.json",
  "id": "authorizeagent.eth",
  "slug": "authorizeagent",
  "display_name": "Authorize Agent",
  "description": "Commercial reference agent for the authorize verb. Creates and manages payment authorizations or mandates without immediate capture.",
  "owner": "commandlayer.eth",
  "ens": "authorizeagent.eth",
  "version": "1.0.0",
  "status": "protocol_reference",
  "class": "commercial",
  "implements": [
    "authorize"
  ],
  "schemas": {
    "request": "https://commandlayer.org/schemas/v1.0.0/commercial/authorize/requests/authorize.request.schema.json",
    "receipt": "https://commandlayer.org/schemas/v1.0.0/commercial/authorize/receipts/authorize.receipt.schema.json"
  },
  "schemas_mirror": {
    "request": "https://commandlayer.org/schemas/v1.0.0/commercial/authorize/requests/authorize.request.schema.json",
    "receipt": "https://commandlayer.org/schemas/v1.0.0/commercial/authorize/receipts/authorize.receipt.schema.json"
  },
  "entry": "x402://authorizeagent.eth/authorize/v1.0.0",
  "capabilities": {
    "operations": [
      "create_authorization",
      "refresh_authorization",
      "cancel_authorization"
    ],
    "input_types": [
      "application/json"
    ],
    "output_types": [
      "application/json"
    ]
  },
  "meta": {
    "publisher": "CommandLayer",
    "contact": "dev@commandlayer.org",
    "tags": [
      "authorize",
      "commercial",
      "payments",
      "mandates"
    ],
    "archival_note": "v1.0.0 is retained for compatibility only. Legacy PGP claims were removed because this repository no longer maintains a verifiable key-distribution path for them."
  },
  "networks": [
    "eip155:1"
  ],
  "license": "Apache-2.0",
  "created_at": "2025-11-22T00:00:00Z",
  "updated_at": "2025-11-22T00:00:00Z"
}
