{
  "$schema": "https://commandlayer.org/agent-cards/schemas/v1.0.0/commons/agent.card.base.schema.json",
  "$id": "https://commandlayer.org/agent-cards/agents/v1.0.0/commons/cleanagent.eth.json",

  "id": "cleanagent.eth",
  "slug": "cleanagent",
  "display_name": "Clean Agent (Protocol Reference)",
  "description": "Official protocol-level reference agent for the clean verb. Performs content sanitization, normalization, redaction, and safe-preprocessing operations according to the clean.request and clean.receipt schemas.",

  "owner": "commandlayer.eth",
  "ens": "cleanagent.eth",
  "version": "1.0.0",
  "status": "protocol_reference",
  "class": "commons",

  "implements": ["clean"],

  "schemas": {
    "request": "https://commandlayer.org/schemas/v1.0.0/commons/clean/requests/clean.request.schema.json",
    "receipt": "https://commandlayer.org/schemas/v1.0.0/commons/clean/receipts/clean.receipt.schema.json"
  },

  "entry": "x402://cleanagent.eth/clean/v1",

  "capabilities": {
    "operations": [
      "strip_noise",
      "normalize_whitespace",
      "remove_tracking_parameters",
      "redact_sensitive_data",
      "standardize_formatting"
    ],
    "input_types": [
      "text/plain",
      "text/markdown",
      "application/json"
    ],
    "output_types": [
      "text/plain",
      "text/markdown",
      "application/json"
    ]
  },

  "meta": {
    "publisher": "CommandLayer",
    "contact": "dev@commandlayer.org",
    "pgp_fingerprint": "5016 D496 9F38 22B2 C5A2 FA40 99A2 6950 197D AB0A",
    "tags": [
      "clean",
      "sanitize",
      "normalize",
      "redact",
      "protocol-reference"
    ]
  },

  "networks": ["eip155:1"],
  "license": "MIT",

  "created_at": "2025-11-22T00:00:00Z",
  "updated_at": "2025-11-22T00:00:00Z"
}
