{
  "$schema": "https://commandlayer.org/agent-cards/schemas/v1.0.0/_shared/agent.card.base.schema.json",
  "$id": "https://commandlayer.org/agent-cards/agents/v1.0.0/commercial/purchaseagent.eth.json",
  "id": "purchaseagent.eth",
  "slug": "purchaseagent",
  "display_name": "Purchase Agent",
  "description": "Commercial reference agent for the purchase verb. Executes direct purchases without complex cart semantics, using purchase.request and purchase.receipt.",
  "owner": "commandlayer.eth",
  "ens": "purchaseagent.eth",
  "version": "1.0.0",
  "status": "protocol_reference",
  "class": "commercial",
  "implements": [
    "purchase"
  ],
  "schemas": {
    "request": "https://commandlayer.org/schemas/v1.0.0/commercial/purchase/requests/purchase.request.schema.json",
    "receipt": "https://commandlayer.org/schemas/v1.0.0/commercial/purchase/receipts/purchase.receipt.schema.json"
  },
  "entry": "x402://purchaseagent.eth/purchase/v1.0.0",
  "capabilities": {
    "operations": [
      "execute_purchase",
      "apply_pricing",
      "record_order"
    ],
    "input_types": [
      "application/json"
    ],
    "output_types": [
      "application/json"
    ]
  },
  "meta": {
    "publisher": "CommandLayer",
    "contact": "dev@commandlayer.org",
    "pgp_fingerprint": "5016 D496 9F38 22B2 C5A2 FA40 99A2 6950 197D AB0A",
    "tags": [
      "purchase",
      "commercial",
      "payments"
    ]
  },
  "networks": [
    "eip155:1"
  ],
  "license": "Apache-2.0",
  "created_at": "2025-11-22T00:00:00Z",
  "updated_at": "2025-11-22T00:00:00Z"
}
