{
  "$schema": "https://commandlayer.org/agent-cards/schemas/v1.0.0/_shared/agent.card.base.schema.json",
  "$id": "https://commandlayer.org/agent-cards/agents/v1.0.0/commons/describeagent.eth.json",
  "id": "describeagent.eth",
  "slug": "describeagent",
  "display_name": "Describe Agent",
  "description": "Reference agent for the describe verb. Produces neutral, descriptive text for content, entities, or behaviors according to the describe.request and describe.receipt schemas.",
  "owner": "commandlayer.eth",
  "ens": "describeagent.eth",
  "version": "1.0.0",
  "status": "protocol_reference",
  "class": "commons",
  "implements": [
    "describe"
  ],
  "schemas": {
    "request": "ipfs://bafybeigvf6nkzws7dblos74dqqjkguwkrwn4a2c27ieygoxmgofyzdkz6m/commons/describe/requests/describe.request.schema.json",
    "receipt": "ipfs://bafybeigvf6nkzws7dblos74dqqjkguwkrwn4a2c27ieygoxmgofyzdkz6m/commons/describe/receipts/describe.receipt.schema.json"
  },
  "schemas_mirror": {
    "request": "https://commandlayer.org/schemas/v1.0.0/commons/describe/requests/describe.request.schema.json",
    "receipt": "https://commandlayer.org/schemas/v1.0.0/commons/describe/receipts/describe.receipt.schema.json"
  },
  "entry": "https://runtime.commandlayer.org/execute",
  "capabilities": {
    "operations": [
      "describe_objects",
      "describe_documents",
      "describe_changes"
    ],
    "input_types": [
      "text/plain",
      "text/markdown",
      "application/json"
    ],
    "output_types": [
      "text/plain",
      "text/markdown"
    ]
  },
  "meta": {
    "publisher": "CommandLayer",
    "contact": "dev@commandlayer.org",
    "pgp_fingerprint": "5016 D496 9F38 22B2 C5A2 FA40 99A2 6950 197D AB0A",
    "tags": [
      "describe",
      "description",
      "protocol-reference"
    ]
  },
  "networks": [
    "eip155:1"
  ],
  "license": "Apache-2.0",
  "created_at": "2025-11-22T00:00:00Z",
  "updated_at": "2026-03-21T00:00:00Z"
}
