{
  "$schema": "https://commandlayer.org/agent-cards/schemas/v1.0.0/_shared/agent.card.base.schema.json",
  "$id": "https://commandlayer.org/agent-cards/agents/v1.0.0/commons/explainagent.eth.json",
  "id": "explainagent.eth",
  "slug": "explainagent",
  "display_name": "Explain Agent",
  "description": "Reference agent for the explain verb. Produces step-by-step or conceptual explanations according to the explain.request and explain.receipt schemas.",
  "owner": "commandlayer.eth",
  "ens": "explainagent.eth",
  "version": "1.0.0",
  "status": "protocol_reference",
  "class": "commons",
  "implements": [
    "explain"
  ],
  "schemas": {
    "request": "ipfs://bafybeigvf6nkzws7dblos74dqqjkguwkrwn4a2c27ieygoxmgofyzdkz6m/commons/explain/requests/explain.request.schema.json",
    "receipt": "ipfs://bafybeigvf6nkzws7dblos74dqqjkguwkrwn4a2c27ieygoxmgofyzdkz6m/commons/explain/receipts/explain.receipt.schema.json"
  },
  "schemas_mirror": {
    "request": "https://commandlayer.org/schemas/v1.0.0/commons/explain/requests/explain.request.schema.json",
    "receipt": "https://commandlayer.org/schemas/v1.0.0/commons/explain/receipts/explain.receipt.schema.json"
  },
  "entry": "x402://explainagent.eth/explain/v1.0.0",
  "capabilities": {
    "operations": [
      "simple_explanations",
      "detailed_explanations",
      "step_by_step_guides"
    ],
    "input_types": [
      "text/plain",
      "text/markdown",
      "application/json"
    ],
    "output_types": [
      "text/plain",
      "text/markdown"
    ]
  },
  "meta": {
    "publisher": "CommandLayer",
    "contact": "dev@commandlayer.org",
    "tags": [
      "explain",
      "explanations",
      "protocol-reference"
    ],
    "archival_note": "v1.0.0 is retained for compatibility only. Legacy PGP claims were removed because this repository no longer maintains a verifiable key-distribution path for them."
  },
  "networks": [
    "eip155:1"
  ],
  "license": "Apache-2.0",
  "created_at": "2025-11-22T00:00:00Z",
  "updated_at": "2025-11-22T00:00:00Z"
}
